{
  "version": "1.0",
  "providers": [
    {"name": "openai", "weight": 100}
  ],
  "post": [
    {
      "id": "mask_pii",
      "mode": "required",
      "config": {
        "mask_email": true
      }
    },
    {
      "id": "format_response",
      "mode": "optional"
    }
  ],
  "metadata": {
    "strategy": "extensions_post_only",
    "description": "Only post-processor extensions"
  }
}

